<?xml version="1.0" encoding="UTF-8"?>

<!DOCTYPE class SYSTEM 'class.dtd'>

<!--
    Document   : pregresso.xml
    Created on : 16 gennaio 2004, 21.25
    Author     : romano
    Description:
        Purpose of the document follows.
-->

<class name="Pregresso">
<description>

<!--        
    iso.addTag("100"+iso.dl+"a"+r.getString("testoHtml"));
    iso.addTag("200"+iso.dl+"a"+r.getString("testoTxt"));
    iso.addTag("300"+iso.dl+"a"+r.getString("autore"));
    iso.addTag("310"+iso.dl+"a"+r.getString("isbd"));
    iso.addTag("320"+iso.dl+"a"+r.getString("isbn"));
    iso.addTag("330"+iso.dl+"a"+r.getString("inventario")+iso.dl+"b"+r.getString("collocazione"));
    iso.addTag("340"+iso.dl+"a"+r.getString("data_ins"));
-->
    <TIT>
        <!-- element tag="200" field="a" / -->
        <element tag="300" field="a" />
        <element tag="310" field="a" />
        
        <element tag="320" field="a" />
        <element tag="330" field="a" />
        <element tag="330" field="b" />
    </TIT>
    
    
</description>
</class>
