<?xml version="1.0" encoding="UTF-8"?>

<!--
    Document   : isisbiblo.xml
    Created on : 16 gennaio 2004, 21.16
    Author     : romano
    Description:
        Purpose of the document follows.
-->

<!DOCTYPE class SYSTEM 'class.dtd'>
<class name="Isisbiblo">
<description>
	<AUT>
            <element tag="011" field="R" />
            <element tag="011" field="A" />
            <element tag="012" field="R" />
            <element tag="014" field="N" />
            <element tag="021" field="R" />
            <element tag="021" field="A" />
            <element tag="031" field="R" />
            <element tag="031" field="A" />
            <element tag="041" field="C" />
            <element tag="041" field="N" />
            <element tag="051" field="C" />
            <element tag="051" field="N" />
            <element tag="054" field="C" />
            <element tag="054" field="N" />
            
            <element tag="011" field="r" />
            <element tag="011" field="a" />
            <element tag="012" field="r" />
            <element tag="014" field="n" />
            <element tag="021" field="r" />
            <element tag="021" field="a" />
            <element tag="031" field="r" />
            <element tag="031" field="a" />
            <element tag="041" field="c" />
            <element tag="041" field="n" />
            <element tag="051" field="c" />
            <element tag="051" field="n" />
            <element tag="054" field="c" />
            <element tag="054" field="n" />
	</AUT>
	<TIT>
            <element tag="011" field="T" />
            <element tag="011" field="C" />
            <element tag="011" field="P" />
            <element tag="011" field="S" />
            <element tag="021" field="T" />
            <element tag="021" field="C" />
            <element tag="021" field="P" />
            <element tag="021" field="S" />
            <element tag="031" field="T" />
            <element tag="031" field="C" />
            <element tag="031" field="P" />
            <element tag="031" field="S" />
            <element tag="045" field="T" />
            <element tag="045" field="P" />
            
            <element tag="011" field="t" />
            <element tag="011" field="c" />
            <element tag="011" field="p" />
            <element tag="011" field="s" />
            <element tag="021" field="t" />
            <element tag="021" field="c" />
            <element tag="021" field="p" />
            <element tag="021" field="s" />
            <element tag="031" field="t" />
            <element tag="031" field="c" />
            <element tag="031" field="p" />
            <element tag="031" field="s" />
            <element tag="045" field="t" />
            <element tag="045" field="p" />
     </TIT>
   	<NUM>
            <element tag="018" field="B" />
            <element tag="018" field="S" />
			<element tag="018" field="b" />
            <element tag="018" field="s" />
	</NUM>
     <CLL>
            <element tag="016" field="T" />
            <element tag="016" field="P" />
            <element tag="016" field="C" />
            
            <element tag="016" field="t" />
            <element tag="016" field="p" />
            <element tag="016" field="c" />            
	</CLL>

</description>
</class>

