<?xml version="1.0" encoding="UTF-8"?>

<!--
	Document   : bibliowin4.xml
	Created on : 14 settembre 2004, 19.45
	Author     : romano
	Description:
	Purpose of the document follows.
-->

<!DOCTYPE class SYSTEM 'class.dtd'>
<class name="Bibliowin4">
	<description>
		<AUT>
			<element tag="700" field="a" />
			<element tag="702" field="a" />
		</AUT>
		<TIT>
			<element tag="200" field="a" />
			<element tag="200" field="e" />
			<element tag="225" field="a" />
			<element tag="300" field="a" />
		</TIT>
		<NUM>
			<element tag="010" field="a" />
		</NUM>
		<LAN>
			<element tag="101" field="a" />
		</LAN>
		<DTE>
			<element tag="211" field="a" />
		</DTE>
		<SBJ>
			<element tag="610" field="a" />
		</SBJ>
		<BIB>
			<element tag="950" field="j" />
		</BIB>
		<INV>
			<element tag="950" field="c" />
		</INV>
		<CLL>
			<element tag="913" field="a" />
		</CLL>
	</description>
</class>