<?xml version="1.0" encoding="UTF-8"?>

<!DOCTYPE class SYSTEM 'class.dtd'>

<class name="Easyweb">
<description>
	<AUT>
            <element tag="710" field="a" />
            <element tag="711" field="a" />
            <element tag="712" field="a" />
	</AUT>
	<TIT>
            <element tag="997" field="a" />
	</TIT>
	<LAN>
            <element tag="030" field="a" />
	</LAN>
	<MAT>
            <element tag="040" field="a" />
	</MAT>	
	<SBJ>
            <element tag="730" field="a" />
	</SBJ>
	<BIB>
            <element tag="800" field="a" />
            <element tag="800" field="b" />
	</BIB>
	<INV>
            <element tag="800" field="d" />
	</INV>
	<CLL>
            <element tag="420" field="a" />
	</CLL>
</description>
</class>