<?xml version="1.0" encoding="UTF-8"?>

<!DOCTYPE class SYSTEM 'class.dtd'>

<!--
    Document   : Eut.xml
    Created on : 1 giugno 2006, 22.12
    Author     : romano
    Description:
    
    <record> 
	 * 	<ID>1</ID> 
	 * 	<Titolo>Le due sponde del Mediterraneo : l'immagine riflessa; 473 p., 24 cm.</Titolo> 
	 * 	<Autore 1>null</Autore 1> 
	 * 	<Autore 2>null</Autore 2> 
	 * 	<Autore 3>null</Autore 3> 
	 * 	<Autore 4>null</Autore 4> 
	 * 	<ISBN>null</ISBN> 
	 * 	<Anno>1999.0</Anno> 
	 * 	<Prezzo>â‚¬ 20,00</Prezzo> 
	 * 	<Abstract>Presentazione ... </Abstract> 
	 * 	<File immagine>due_sponde_mediterraneo</File immagine> 
	 * </record>
        
-->

<class  name="Eut">



	<description>
	<!-- 
		<filter>
				<element tag="Eut.xslt" field="" />
		</filter>
	-->
		<AUT>
				<element tag="/record/Autore1" field="" />
				<element tag="/record/Autore2" field="" />
				<element tag="/record/Autore3" field="" />
				<element tag="/record/Autore4" field="" />
		</AUT>
		<TIT>
	            <element tag="/record/Titolo" field="" />
		</TIT>
		<NUM>
	            <element tag="/record/ISBN" field="" />
		</NUM>
		<ABS>
				<element tag="/record/Abstract" field="" />
		</ABS>
	</description>
	<!-- 
	<input>
		<record>
			<titolo cols="80" rows="3"></titolo>
			<autore cols="40" rows="3"></autore>
			<isbn></isbn>
			<anno>1999</anno>
			<prezzo>20</prezzo>
			<immagine>image001.jpg</immagine>
			<abstract></abstract>
		</record>
	</input>
	-->
</class>